{
  "snapshotId": "settings:1.10.0:device-a:vault-alpha:project/alpha:session-a:3:7:2:1",
  "registryVersion": "1.10.0",
  "context": {
    "userDeviceId": "device-a",
    "vaultId": "vault-alpha",
    "workspaceProjectId": "project/alpha",
    "sessionId": "session-a"
  },
  "effective": [
    {
      "key": "models.agent.mode",
      "value": "inherit",
      "winningScope": "product",
      "assignmentProvenance": {
        "actor": "registry",
        "source": "registry/v1.json"
      },
      "validation": {
        "valid": true,
        "issues": []
      },
      "applyMode": "next-operation",
      "overriddenCandidates": []
    },
    {
      "key": "models.agent.provider",
      "value": "ollama",
      "winningScope": "product",
      "assignmentProvenance": {
        "actor": "registry",
        "source": "registry/v1.json"
      },
      "validation": {
        "valid": true,
        "issues": []
      },
      "applyMode": "next-operation",
      "overriddenCandidates": []
    },
    {
      "key": "models.agent.base_url",
      "value": "http://127.0.0.1:11434/v1",
      "winningScope": "product",
      "assignmentProvenance": {
        "actor": "registry",
        "source": "registry/v1.json"
      },
      "validation": {
        "valid": true,
        "issues": []
      },
      "applyMode": "next-operation",
      "overriddenCandidates": []
    },
    {
      "key": "models.agent.model",
      "value": "qwen3:8b",
      "winningScope": "product",
      "assignmentProvenance": {
        "actor": "registry",
        "source": "registry/v1.json"
      },
      "validation": {
        "valid": true,
        "issues": []
      },
      "applyMode": "next-operation",
      "overriddenCandidates": []
    },
    {
      "key": "models.agent.secret_ref",
      "value": {
        "secretRef": {
          "provider": "environment",
          "locator": "OPENAI_API_KEY"
        },
        "status": "missing"
      },
      "winningScope": "product",
      "assignmentProvenance": {
        "actor": "registry",
        "source": "registry/v1.json"
      },
      "validation": {
        "valid": true,
        "issues": []
      },
      "applyMode": "next-operation",
      "overriddenCandidates": []
    },
    {
      "key": "adapters.enabled",
      "value": [
        "filesystem",
        "memu",
        "gitnexus",
        "obsidian",
        "kanban",
        "qmd",
        "lightrag",
        "raganything",
        "hindsight",
        "vaultbrain",
        "graphify"
      ],
      "winningScope": "product",
      "assignmentProvenance": {
        "actor": "registry",
        "source": "registry/v1.json"
      },
      "validation": {
        "valid": true,
        "issues": []
      },
      "applyMode": "restart-required",
      "overriddenCandidates": []
    },
    {
      "key": "adapters.memu.dsn",
      "value": "postgresql://localhost:5432/memu",
      "winningScope": "product",
      "assignmentProvenance": {
        "actor": "registry",
        "source": "registry/v1.json"
      },
      "validation": {
        "valid": true,
        "issues": []
      },
      "applyMode": "restart-required",
      "overriddenCandidates": []
    },
    {
      "key": "adapters.memu.secret_ref",
      "value": {
        "secretRef": {
          "provider": "environment",
          "locator": "MEMU_DSN"
        },
        "status": "missing"
      },
      "winningScope": "product",
      "assignmentProvenance": {
        "actor": "registry",
        "source": "registry/v1.json"
      },
      "validation": {
        "valid": true,
        "issues": []
      },
      "applyMode": "restart-required",
      "overriddenCandidates": []
    },
    {
      "key": "adapters.memu.user_id",
      "value": "default",
      "winningScope": "product",
      "assignmentProvenance": {
        "actor": "registry",
        "source": "registry/v1.json"
      },
      "validation": {
        "valid": true,
        "issues": []
      },
      "applyMode": "restart-required",
      "overriddenCandidates": []
    },
    {
      "key": "adapters.memu.max_results",
      "value": 20,
      "winningScope": "product",
      "assignmentProvenance": {
        "actor": "registry",
        "source": "registry/v1.json"
      },
      "validation": {
        "valid": true,
        "issues": []
      },
      "applyMode": "restart-required",
      "overriddenCandidates": []
    },
    {
      "key": "adapters.memu.query_timeout_ms",
      "value": 5000,
      "winningScope": "product",
      "assignmentProvenance": {
        "actor": "registry",
        "source": "registry/v1.json"
      },
      "validation": {
        "valid": true,
        "issues": []
      },
      "applyMode": "restart-required",
      "overriddenCandidates": []
    },
    {
      "key": "adapters.memu.exclude_memory_types",
      "value": [
        "event"
      ],
      "winningScope": "product",
      "assignmentProvenance": {
        "actor": "registry",
        "source": "registry/v1.json"
      },
      "validation": {
        "valid": true,
        "issues": []
      },
      "applyMode": "restart-required",
      "overriddenCandidates": []
    },
    {
      "key": "adapters.memu.graph_python",
      "value": "python",
      "winningScope": "product",
      "assignmentProvenance": {
        "actor": "registry",
        "source": "registry/v1.json"
      },
      "validation": {
        "valid": true,
        "issues": []
      },
      "applyMode": "restart-required",
      "overriddenCandidates": []
    },
    {
      "key": "adapters.memu.graph_cwd",
      "value": ".",
      "winningScope": "product",
      "assignmentProvenance": {
        "actor": "registry",
        "source": "registry/v1.json"
      },
      "validation": {
        "valid": true,
        "issues": []
      },
      "applyMode": "restart-required",
      "overriddenCandidates": []
    },
    {
      "key": "adapters.memu.graph_timeout_ms",
      "value": 15000,
      "winningScope": "product",
      "assignmentProvenance": {
        "actor": "registry",
        "source": "registry/v1.json"
      },
      "validation": {
        "valid": true,
        "issues": []
      },
      "applyMode": "restart-required",
      "overriddenCandidates": []
    },
    {
      "key": "adapters.memu.search_script",
      "value": "memu_search.py",
      "winningScope": "product",
      "assignmentProvenance": {
        "actor": "registry",
        "source": "registry/v1.json"
      },
      "validation": {
        "valid": true,
        "issues": []
      },
      "applyMode": "restart-required",
      "overriddenCandidates": []
    },
    {
      "key": "adapters.memu.search_python",
      "value": "python",
      "winningScope": "product",
      "assignmentProvenance": {
        "actor": "registry",
        "source": "registry/v1.json"
      },
      "validation": {
        "valid": true,
        "issues": []
      },
      "applyMode": "restart-required",
      "overriddenCandidates": []
    },
    {
      "key": "adapters.memu.search_timeout_ms",
      "value": 20000,
      "winningScope": "product",
      "assignmentProvenance": {
        "actor": "registry",
        "source": "registry/v1.json"
      },
      "validation": {
        "valid": true,
        "issues": []
      },
      "applyMode": "restart-required",
      "overriddenCandidates": []
    },
    {
      "key": "toolchain.provider_selection",
      "value": [
        "opencli",
        "qmd",
        "graphify",
        "ollama",
        "lightrag",
        "raganything",
        "mcp-sdk"
      ],
      "winningScope": "product",
      "assignmentProvenance": {
        "actor": "registry",
        "source": "registry/v1.json"
      },
      "validation": {
        "valid": true,
        "issues": []
      },
      "applyMode": "next-operation",
      "overriddenCandidates": []
    },
    {
      "key": "toolchain.capability_profiles",
      "value": {
        "opencli": {
          "invocationMode": "cli",
          "versionPolicy": ">=1.8 <2",
          "requiredFeatures": [
            "version.structured",
            "command.list.structured"
          ],
          "timeoutMs": 15000,
          "profileRevision": "opencli/1.8"
        },
        "qmd": {
          "invocationMode": "cli",
          "versionPolicy": ">=2.5 <3",
          "requiredFeatures": [
            "query.hybrid",
            "query.intent",
            "uri.qmd",
            "index.health"
          ],
          "timeoutMs": 30000,
          "profileRevision": "qmd/2.5",
          "indexId": "",
          "collectionIds": []
        },
        "graphify": {
          "invocationMode": "cli",
          "versionPolicy": ">=0.9 <1",
          "requiredFeatures": [
            "graph.query",
            "result.normalized"
          ],
          "timeoutMs": 30000,
          "profileRevision": "graphify/0.9"
        },
        "ollama": {
          "invocationMode": "http",
          "versionPolicy": ">=0.3",
          "requiredFeatures": [
            "embeddings.openai-compatible",
            "model.fingerprint"
          ],
          "timeoutMs": 30000,
          "profileRevision": "ollama/openai-embeddings-v1"
        },
        "lightrag": {
          "invocationMode": "http",
          "versionPolicy": "wrapper-defined",
          "requiredFeatures": [
            "query",
            "health"
          ],
          "timeoutMs": 30000,
          "profileRevision": "lightrag/wrapper-v1"
        },
        "raganything": {
          "invocationMode": "http",
          "versionPolicy": "wrapper-defined",
          "requiredFeatures": [
            "query",
            "health"
          ],
          "timeoutMs": 30000,
          "profileRevision": "raganything/wrapper-v1"
        },
        "mcp-sdk": {
          "invocationMode": "sdk",
          "versionPolicy": ">=1 <2",
          "requiredFeatures": [
            "transport.stdio",